nom,couleur,prix,collection,categorie,pourcentage,matiere_principale
ROBE MI-LONGUE FLUIDE,Mauve poudré,25.99,femme,ROBE,88,viscose
SANDALES À BRIDES ET DÉCOR MÉTALLIQUE,Marron,39.95,femme,SANDALES,100,polyuréthane
COMBI-SHORT LYOCELL,Noir,35.95,femme,COMBI-SHORT,100,lyocell
JEAN TRF LOOSE FOLDED TAILLE BASSE À RAYURES,unique,35.95,femme,JEAN,100,coton
ROBE FLUIDE À ENCOLURE AMÉRICAINE,Vert huile,35.95,femme,ROBE,86,viscose
VESTE CROISÉE,brique foncée,32.95,femme,VESTE,89,viscose
LOT DE 3 BRACELETS BOIS ET RÉSINE,Multicolore,19.95,femme,LOT,60,bois de manguier
SANDALES À TALONS IMPRIMÉES,Léopard,32.95,femme,SANDALES,100,polyester
SHORT FLUIDE AVEC BOUTONS,Mauve clair,22.95,femme,SHORT,83,viscose
T-SHIRT TEXTE BRILLANT EFFET DÉLAVÉ,Gris anthracite,19.95,femme,T-SHIRT,95,coton
VESTE À RAYURES 100% LIN,Brown Stripes,45.95,femme,VESTE,100,lin
PANTALON DROIT À RAYURES,Beige-marron,39.95,femme,PANTALON,86,coton
CHEMISE CINTREE FRONCEE,Écru / Noir,25.95,femme,CHEMISE,97,coton
CHEMISE FLUIDE À MANCHES COURTES,Mauve clair,25.95,femme,CHEMISE,83,viscose
BLOUSON AJUSTÉ À BRANDEBOURGS,Blanc,59.95,femme,BLOUSON,100,coton
TOP À BOUTONS ET LIN,bleu-poudré,15.95,femme,TOP,70,coton
TOP EN GEORGETTE À ENCOLURE AMÉRICAINE ET À POIS,Blanc / Noir,22.95,femme,TOP,100,polyester
TOP FLUIDE COL EN V,Écru,22.95,femme,TOP,76,polyester
CHEMISE OVERSIZE EN COTON,Bleu marine,22.95,femme,CHEMISE,100,coton
ROBE COURTE HALTER FLUIDE,Noir,29.95,femme,ROBE,100,lyocell
JUPE ASYMÉTRIQUE FLUIDE,Sable,29.95,femme,JUPE,76,polyester
SHORT MINI DENIM TRF ÉTOILES,Bleu,29.95,femme,SHORT,100,coton
CHEMISE FLUIDE À MANCHES COURTES,Bleu clair,29.95,femme,CHEMISE,65,lyocell
PANTALON À RAYURES 100 % LIN,Brown Stripes,39.95,femme,PANTALON,100,lin
BONNET LISSE CALOTTE,Beige clair,25.95,femme,BONNET,63,pâte de cellulose
SHORT ÉVASÉ EN SATIN,Imprimée,25.95,femme,SHORT,97,polyester
PANTALON FLUIDE LARGE,brique foncée,32.95,femme,PANTALON,89,viscose
PANTALON FLUIDE À CORDONS,Bleu clair,29.95,femme,PANTALON,65,lyocell
SANDALES PLATES EN DAIM À BOUCLE,Marron,35.95,femme,SANDALES,100,cuir de vache
BONNET CALOT TRESSÉ,Marron,17.95,femme,BONNET,100,polyester
ROBE COURTE EN MAILLE À RAYURES,Blanc / Noir,29.95,femme,ROBE,54,polyester
LUNETTES DE SOLEIL RECTANGULAIRES,Rouge foncé,59.95,homme,LUNETTES,100,acétate
BLAZER REGULAR FIT EN DAIM,Sable,199.0,homme,BLAZER,100,cuir de chèvre
SAC SHOPPER EN TISSU,Blanc écru,29.95,homme,SAC,100,coton
T-SHIRT IMPRIMÉ CONTRASTANT AVEC PIÈCE,Bleu ciel,22.95,homme,T-SHIRT,100,coton
PANTALON À PLIS DE COSTUME 100 % LIN,Blanc,59.95,homme,PANTALON,100,lin
LUNETTES DE SOLEIL ŒIL-DE-CHAT,Noir,59.95,homme,LUNETTES,77,diacétate de cellulose
LUNETTES DE SOLEIL RECTANGULAIRES,Écaille,59.95,homme,LUNETTES,100,acétate
BLOUSON TECHNIQUE RELAXED FIT,Écru,59.95,homme,BLOUSON,100,polyamide
CHEMISE À CARREAUX BRODÉE CONTRASTÉE,CAMEL/BLANC,35.95,homme,CHEMISE,100,coton
JORT EN DENIM À CEINTURE,Marron,49.95,homme,JORT,100,coton
MOCASSINS EN CUIR AVEC MASQUE,Noir,59.95,homme,MOCASSINS,100,cuir de vache
SAC BANDOULIÈRE EN CUIR,Noir,49.95,homme,SAC,100,cuir de vache
POLO TECHNIQUE À ZIP,Écru moyen,35.95,homme,POLO,64,polyester
SAC BANDOULIÈRE UNIE,Marron,35.95,homme,SAC,100,polyester
ESPADRILLE EN CUIR,Marron sable,55.95,homme,ESPADRILLE,100,cuir de vache
SWEAT PIQUÉ COL ZIPPÉ,Bleu marine,35.95,homme,SWEAT,100,coton
BANDANA À IMPRIMÉ GÉOMÉTRIQUE GRAPHIQUE,Bleu marine,15.95,homme,BANDANA,100,coton
CHEMISE FLUIDE À IMPRIMÉ FLEURI,Bleu moyen,45.95,homme,CHEMISE,85,viscose
CHEMISE SMOKING À POIGNETS MOUSQUETAIRES,Blanc,39.95,homme,CHEMISE,100,coton
PANTALON RELAXED STRAIGHT FIT À RAYURES,Rayures,49.95,homme,PANTALON,100,coton
VESTE EN DENIM AVEC BRANDENBOURGS ET BOUTONS,Charbon,89.95,homme,VESTE,100,coton
BLOUSON DÉLAVÉ COUPE DÉCONTRACTÉE,Bleu encre,49.95,homme,BLOUSON,100,coton
CHEMISE À CARREAUX LIN ET COTON,Grisâtre,39.95,homme,CHEMISE,66,coton
VESTE DE COSTUME À BOUTONNAGE CROISÉ 100% LIN CHEVRON,Indigo,139.0,homme,VESTE,100,lin
BERMUDA FLUIDE DOUCE À PLIS,Bleu marine,35.95,homme,BERMUDA,88,modal
LUNETTES DE SOLEIL OVALES,Vert olive,59.95,homme,LUNETTES,73,diacétate de cellulose
CHEMISE EN MAILLE REGULAR FIT,Vert clair,39.95,homme,CHEMISE,40,papier
VESTE DE COSTUME RELAXED FIT 100% LIN,Blanc,119.0,homme,VESTE,100,lin
PANTALON REGULAR FIT DE SMOKING À BANDES,Noir,59.95,homme,PANTALON,51,polyester
LUNETTES DE SOLEIL RECTANGULAIRES,990,59.95,homme,LUNETTES,100,acétate
CEINTURE EN CUIR EFFET VINTAGE,Noir,35.95,homme,CEINTURE,100,cuir de vachette
PANTALON CHINO STRAIGHT FIT DÉLAVÉ,Bleu,49.95,homme,PANTALON,100,coton
POLO STRUCTURÉ EN PIQUÉ,Blanc cassé,29.95,homme,POLO,97,coton
PANTALON COUPE DÉCONTRACTÉE À PLIS,Blanc cassé,59.95,homme,PANTALON,100,coton
T-SHIRT EN JACQUARD À RAYURES,Bleu,29.95,homme,T-SHIRT,100,coton
CHEMISE RELAXED FIT 100% LIN POCHES PLIS,Marron / Taupe,39.95,homme,CHEMISE,100,lin
CHEMISE COL SMOKING,Blanc,39.95,homme,CHEMISE,100,coton
VESTE À RAYURES 100 % LIN,Indigo,99.95,homme,VESTE,100,lin
CHEMISE REGULAR FIT 100% LIN,Sable / Chiné,39.95,homme,CHEMISE,100,lin
CHEMISE À RAYURES ET IMPRIMÉ CITRONS,Jaune,35.95,homme,CHEMISE,98,coton
PANTALON COUPE DÉCONTRACTÉE EN VISCOSE ET CHANVRE,Blanc cassé,49.95,homme,PANTALON,70,viscose
LUNETTES DE SOLEIL OVALES,Marron,59.95,homme,LUNETTES,65,acier inoxydable
POLO PIQUÉ REGULAR FIT,Bleu roi,29.95,homme,POLO,100,coton
PANTALON RELAXED FIT VISCOSE LIN CEINTURE,Noir,49.95,homme,PANTALON,65,viscose
CHEMISE RELAXED FIT À IMPRIMÉ GÉOMÉTRIQUE,Tuile,35.95,homme,CHEMISE,100,coton
CHEMISE RELAXED FIT VISCOSE - CHANVRE,Blanc cassé,39.95,homme,CHEMISE,70,viscose
SURCHEMISE À PIÈCES ÉTOILES,Bleu encre,69.95,homme,SURCHEMISE,100,coton
CHEMISE REGULAR FIT 100% LIN,Marron chiné,39.95,homme,CHEMISE,100,lin
PANTALON REGULAR FIT VISCOSE - COTON,Blanc cassé,59.95,homme,PANTALON,49,viscose
CHAUSSETTES CANNELÉES,Jaune,7.95,homme,CHAUSSETTES,80,coton
DÉBARDEUR EN MAILLE IMPRIMÉ LAVÉ,Noir,22.95,homme,DÉBARDEUR,100,coton
T-SHIRT REGULAR FIT JACQUARD À RAYURES,blanc-orange,22.95,homme,T-SHIRT,100,coton
BLAZER SMOKING À REVERS CHÂLE,Noir,119.0,homme,BLAZER,51,polyester
PANTALON RELAXED FIT VISCOSE - LIN CEINTURE,Écru,49.95,homme,PANTALON,65,viscose
LUNETTES DE SOLEIL MÉTALLIQUES CARRÉES,Argent,59.95,homme,LUNETTES,90,acier inoxydable
CHEMISE À CARREAUX LIN ET COTON,Grisâtre,39.95,homme,CHEMISE,66,coton
BERMUDA REGULAR FIT À PLIS,Blanc cassé,35.95,homme,BERMUDA,89,coton
CEINTURE EN SOIE POUR SMOKING,Noir,35.95,homme,CEINTURE,100,soie (de mûrier)
PANTALON REGULAR FIT À PLIS SMOKING,Noir,59.95,homme,PANTALON,50,laine
CHEMISE RELAXED FIT TEXTE PIÈCES,Écru,35.95,homme,CHEMISE,100,coton
LUNETTES DE SOLEIL MÉTALLIQUES OVALES,Argent Mat,59.95,homme,LUNETTES,90,acier inoxydable
CHEMISE RELAXED FIT À IMPRIMÉ PATCHWORK,Multicolore,45.95,homme,CHEMISE,85,viscose
BERMUDA EN JEAN RELAXED FIT PLISSE,Bleu,49.95,homme,BERMUDA,100,coton
BLOUSON DÉLAVÉ COUPE DÉCONTRACTÉE,Bleu encre,49.95,homme,BLOUSON,100,coton
SANDALES STYLE PÊCHEUR EN CUIR,Beige,59.95,homme,SANDALES,100,cuir de vache
T-SHIRT RELAXED FIT À IMPRIMÉ GRAPHIQUE,Bordeaux,22.95,homme,T-SHIRT,100,coton
BANDANA À IMPRIMÉ PAISLEY,Bleu,15.95,homme,BANDANA,100,coton
CHEMISE FLUIDE SOFT,Bleu marine,39.95,homme,CHEMISE,88,modal
CHEMISE REGULAR FIT 100% LIN,Blanc,39.95,homme,CHEMISE,100,lin
SAC BANDOULIÈRE EN CUIR,Vert kaki,35.95,homme,SAC,100,cuir de porc
SURCHEMISE RELAXED FIT ZIPPÉE,Bleu,35.95,homme,SURCHEMISE,100,coton
BERMUDA BAGGY FIT À BOUTONS,brun,35.95,homme,BERMUDA,100,coton
JEAN DROIT CONTRASTE,Gris / Beige,49.95,homme,JEAN,100,coton
COLLIER FANTAISIE PIERRE,bleu/noir,22.95,homme,COLLIER,95,pierre
PANTALON DE COSTUME CHEVRON 100% LIN,Indigo,69.95,homme,PANTALON,100,lin
SAC SHOPPER TRESSÉ,Marron,35.95,homme,SAC,100,papier
VESTE EN JEAN À FERMETURE ÉCLAIR,Bleu,59.95,homme,VESTE,100,coton
CEINTURE EN CUIR TRESSÉ,Noir,35.95,homme,CEINTURE,100,cuir de vachette
PANTALON CARGO PARACHUTE DÉLAVÉ,Gris clair,49.95,homme,PANTALON,100,coton
SABOTS EN CUIR,Vert d'eau,49.95,homme,SABOTS,100,cuir de vache
BASKETS STYLE RÉTRO,Multicolore,39.95,homme,BASKETS,70,polyester
LUNETTES DE SOLEIL ŒIL-DE-CHAT,Noir,59.95,homme,LUNETTES,77,diacétate de cellulose
T-SHIRT RELAXED FIT À IMPRIMÉ GRAPHIQUE,Blanc,22.95,homme,T-SHIRT,100,coton
FRISBEE GRAPHIQUE IMPRIMÉ,Rouge,22.95,homme,FRISBEE,100,polyéthylène
CHAPEAU BOB BORD LARGE,Kaki,22.95,homme,CHAPEAU,100,coton
CEINTURE EN CUIR SURPIQUÉE,Noir,35.95,homme,CEINTURE,100,cuir de vachette
VESTE REGULAR FIT À POCHES,Blanc cassé,59.95,homme,VESTE,100,coton
MOCASSINS EN CUIR À MASQUE,Marron,99.95,homme,MOCASSINS,100,cuir de vache
PULL REGULAR FIT 100% LIN,Bleu / Acier,69.95,homme,PULL,100,lin
CHEMISE FLUIDE À NŒUD,Blanc,39.95,homme,CHEMISE,90,viscose
T-SHIRT EN MAILLE DÉLAVÉ IMPRIMÉS,Noir,25.95,homme,T-SHIRT,100,coton
CHEMISE STRUCTURÉE OXFORD,Bleu / Blanc,29.95,homme,CHEMISE,100,coton
MAILLOT DE BAIN DEUX PIÈCES BRILLANT 6-14 ANS,Bleu clair,19.95,fille,MAILLOT,76,polyamide
ENSEMBLE T-SHIRT ET BERMUDA À RAYURES,Bleu,17.95,fille,ENSEMBLE,62,polyester
BALLERINES SPORT BAREFOOT,Blanc écru,35.95,fille,BALLERINES,63,polyester
PANTALON EN MOLLETON WIDE LEG PENN ©,Vert / Écru,22.95,fille,PANTALON,100,coton
SHORT À RAYURES PENN ©,Bleu clair,19.95,fille,SHORT,99,coton
TOP HALTER FANTAISIE,Jaune,7.95,fille,TOP,94,coton
LOT DE DEUX COLLIERS FANTAISIE ET COQUILLAGES,Turquoise,7.95,fille,LOT,80,verre
JUPE À PLIS PLATS PENN ©,Bleu marine foncé,22.95,fille,JUPE,69,viscose
TOP POLO À RAYURES PENN ©,Bleu marine foncé,22.95,fille,TOP,73,viscose
BASKETS DE SPORT COMBINÉES,Bleu,29.95,fille,BASKETS,82,polyester
POLO BRODÉ PENN ©,Vert,14.95,fille,POLO,100,coton
MAILLOT DE BAIN FLEUR HIBISCUS 2-6 ANS,Fuchsia,15.95,fille,MAILLOT,85,polyester
SANDALES DE BAIN CŒUR,Rose,15.95,fille,SANDALES,100,caoutchouc
SALOPETTE COURTE À RAYURES PENN ©,Rayures,29.95,fille,SALOPETTE,100,coton
SWEAT PENN ©,Gris chiné,25.95,fille,SWEAT,62,coton
BLOUSON LÉGER DÉPERLANT PENN ©,Bleu,45.95,fille,BLOUSON,100,polyamide
SHORT EFFET SERVIETTE PENN ©,Vert,17.95,fille,SHORT,79,coton
TENNIS EN CUIR,Blanc,39.95,fille,TENNIS,51,cuir de vache
MAILLOT DE BAIN À RAYURES 6-14 ANS,Rayures,17.95,fille,MAILLOT,85,polyester
PANTALON LARGE SCHIFFLY,Vert,25.95,fille,PANTALON,100,coton
TOP POLO TORSADÉ PENN ©,Rose fluo,22.95,fille,TOP,87,coton
PARÉO HIBISCUS ET FANTAISIES,Fuchsia,15.95,fille,PARÉO,100,coton
PORTE-CLÉS PENDENTIF PENN ©,Vert,12.95,fille,PORTE-CLÉS,43,fer
LOT DE CINQ CHAUSSETTES HAUTES À RAYURES,Multicolore,8.95,fille,LOT,77,coton
T-SHIRT EPAIS RAYURES,Rose / Blanc,10.95,fille,T-SHIRT,100,coton
SAC BOWLING PENN ©,Blanc,45.95,fille,SAC,100,polyester
TENNIS OU BASKET À SEMELLE ÉPAISSE,Blanc,25.95,fille,TENNIS,100,polyuréthane
ENSEMBLE T-SHIRT À LACETS ET PANTALON JOGGER,Bleu moyen,19.95,fille,ENSEMBLE,100,coton
BASKET OUVERTE,Argent,35.95,fille,BASKET,60,polyuréthane
SANDALES EN CUIR,Noir,39.95,fille,SANDALES,100,cuir de mouton
LOT DE TROIS CHAUSSETTES HAUTES À RAYURES SPORTIVES,Blanc,6.95,fille,LOT,74,coton
T-SHIRT STICKERS HELLO KITTY © SANRIO,Blanc,10.95,fille,T-SHIRT,100,coton
GRANDE BALLE DE TENNIS AVEC BOÎTE PENN ©,Jaune,15.95,fille,GRANDE,80,acrylique
LUNETTES DE SOLEIL EN PLASTIQUE FINES,Bleu clair,10.95,fille,LUNETTES,100,PCTG
GILET MATELASSÉ,Bleu marine,29.95,fille,GILET,100,polyamide
LOT DE TROIS PINCES À RAYURES,Bleu,6.95,fille,LOT,100,plastique-acrylique
SHORT 100 % LIN,Vert olive,22.95,fille,SHORT,100,lin
PANTALON IMPRIMÉ FLEURS AVEC LIN,Écru,22.95,fille,PANTALON,61,viscose
TENNIS À LACETS,Blanc,22.95,fille,TENNIS,100,polyuréthane
T-SHIRT JOGGING EN MOLLETON,Sable / Chiné,12.95,fille,T-SHIRT,100,coton
LOT DE DEUX COLLIERS PAPILLONS,Doré,6.95,fille,LOT,100,fer
BERMUDA PENN ©,Écru,17.95,fille,BERMUDA,100,coton
JUPE-SHORT À VOLANTS ET RAYURES,Blanc,17.95,fille,JUPE-SHORT,66,polyester
CHEMISE TEXTURÉE À RAYURES PENN ©,Bleu clair,25.95,fille,CHEMISE,99,coton
SAC BANDOULIÈRE FANTAISIE,Multicolore,25.95,fille,SAC,100,coton
BLOUSON KANGOUROU PENN ©,Vert,29.95,fille,BLOUSON,100,polyamide
CASQUETTE BRODÉE PENN ©,Vert,12.95,fille,CASQUETTE,100,coton
BONNET BOB PENN ©,Beige,12.95,fille,BONNET,100,coton
LOT DE QUATRE CHOUCHOUS À RAYURES,Multicolore,4.95,fille,LOT,73,polyamide
BONNET BOB TEXTE BRODÉ,Turquoise,10.95,fille,BONNET,100,coton
ROBE DRAPÉE EN LIN,Rose fluo,27.95,fille,ROBE,61,viscose
SHORT EN JEAN DÉCHIRÉ,Rouge,17.95,fille,SHORT,100,coton
CHEMISE À RAYURES PENN ©,Vert / Écru,29.95,fille,CHEMISE,100,coton
BALLERINES SPORT,Bleu,29.95,fille,BALLERINES,83,polyester
6-14 ANS/ MAILLOT DE BAIN TEXTURE FLEURS 3D,Bleu moyen,17.95,fille,6-14,91,polyamide
HAUT DÉTAIL EN MAILLE CROCHET,Blanc,9.95,fille,HAUT,100,coton
LEGGING COURT CÔTELÉ,Jaune,4.95,fille,LEGGING,95,coton
BASKET COMPENSÉE,Blanc,22.95,fille,BASKET,100,polyuréthane
TOP BOULE EN LIN,Écru,22.95,fille,TOP,61,viscose
LOT TROIS HAUTS À RAYURES,Divers,14.95,fille,LOT,100,coton
LOT DE TROIS PINCES FLEURS HIBISCUS,Vert,6.95,fille,LOT,100,plastique
PANTALON EN MOLLETON HEAVY JERSEY À JAMBES LARGES,Jaune,12.95,fille,PANTALON,100,coton
PONCHO SERVIETTE À POIS,Rose,19.95,fille,PONCHO,100,coton
BERMUDA EN JEAN À RAYURES,Bordeaux,19.95,fille,BERMUDA,100,coton
T-SHIRT TEINT EN PIÈCE IMPRIMÉ,Gris anthracite,9.95,fille,T-SHIRT,100,coton
T-SHIRT IMPRIMÉ PENN ©,Blanc,12.95,fille,T-SHIRT,100,coton
CHAPEAU BOB COUTURES,Écru / Chiné,9.95,fille,CHAPEAU,100,coton
CASQUETTE EFFET DÉLAVÉ BRODÉE,Bleu,7.95,fille,CASQUETTE,100,coton
POLO BRODÉ PENN ©,Écru,14.95,fille,POLO,100,coton
CIRÉ EFFET GOMME À CAPUCHE DÉPERLANT,Bis,35.95,fille,CIRÉ,100,polyester
6-14 ANS/BIKINI TEXTURE NŒUD,Fuchsia,17.95,fille,6-14,92,polyester
SAC BANDOULIÈRE TECHNIQUE,Multicolore,19.95,fille,SAC,100,polyamide
BERMUDA WAFFLE À INSCRIPTION,Jaune,8.95,fille,BERMUDA,100,coton
T-SHIRT RAYÉ À MANCHES RAGLAN,Jaune,9.95,fille,T-SHIRT,90,coton
VESTE EN JEAN,Bleu,25.95,fille,VESTE,100,coton
SANDALES TECHNIQUES,Noir,29.95,fille,SANDALES,96,polyester
T-SHIRT IMPRIMÉ PENN ©,Vert,12.95,fille,T-SHIRT,100,coton
HAUT CÔTELÉ NAGEUR,Bleu roi,5.95,fille,HAUT,95,coton
BERMUDA 100% LIN,Rose,22.95,fille,BERMUDA,100,lin
SAC À DOS TECHNIQUE,Multicolore,35.95,fille,SAC,100,polyamide
GILET EN NYLON PENN ©,Bleu marine,29.95,fille,GILET,100,polyamide
GILET EN MAILLE PENN ©,Écru,29.95,fille,GILET,100,coton
PANTALON À PLIS PENN ©,Pierre,45.95,fille,PANTALON,100,coton
SWEAT ZIPPÉ BASIQUE,Écru,17.95,fille,SWEAT,60,coton
SWEAT À INSCRIPTION PENN ©,Vert,25.95,fille,SWEAT,100,coton
GILET EN MAILLE PENN ©,Vert / Écru,22.95,fille,GILET,100,coton
TENNIS OU BASKET AVEC DÉTAIL CŒUR,Blanc,25.95,fille,TENNIS,80,polyuréthane
LOT DE CINQ SOCQUETTES,Multicolore,7.95,fille,LOT,74,coton
LUNETTES DE SOLEIL CARRÉES EN PLASTIQUE,Bleu,10.95,fille,LUNETTES,100,PCTG
CASQUETTE EN RÉSILLE BRODERIE FLORALE,Jaune,8.95,fille,CASQUETTE,100,coton
TENNIS PENN ©,Blanc,39.95,fille,TENNIS,78,polyuréthane
TENNIS À RABAT ET PIÈCES,Blanc,29.95,fille,TENNIS,60,polyuréthane
T-SHIRT À INSCRIPTION IMPRIMÉE,Jaune,8.95,fille,T-SHIRT,100,coton
BERMUDA DE JOGGING EN MOLLETON,Sable / Chiné,8.95,fille,BERMUDA,100,coton
LOT BANDEAU ET BRACELET PENN ©,Bleu roi,8.95,fille,LOT,76,coton
ENSEMBLE CÔTELÉ DÉLAVÉ T-SHIRT NAGEUR ET BERMUDA,Pourpre,17.95,fille,ENSEMBLE,97,coton
SHORT À INSCRIPTION ET CONTRASTE,Blanc,8.95,fille,SHORT,65,coton
SHORT EN POPELINE À PINCES PENN ©,Beige clair,22.95,fille,SHORT,100,coton
BERMUDA EN JEAN LONGUE PENN ©,Bleu clair,22.95,fille,BERMUDA,60,coton
CASQUETTE RÉSILLE MINECRAFT © MOJANG AB. ™,Vert,9.95,garçon,CASQUETTE,100,coton
6-14 ANS / SHORT DE BAIN UNI,Citron vert,16.95,garçon,6-14,100,polyamide
T-SHIRT SPORT À INSCRIPTION,Mandarine,12.95,garçon,T-SHIRT,52,polyester
PANTALON EN MOLLETON WIDE LEG PENN ©,Vert / Écru,22.95,garçon,PANTALON,100,coton
SHORT À RAYURES PENN ©,Bleu clair,19.95,garçon,SHORT,99,coton
SWEAT IMPRIMÉ,Écru,19.95,garçon,SWEAT,62,coton
ENSEMBLE T-SHIRT ET BERMUDA UNI TEINT SUR PIÈCE,Grenat clair,22.95,garçon,ENSEMBLE,100,coton
JEAN RELAXED BALLON,Bleu clair,22.95,garçon,JEAN,100,coton
JUPE À PLIS PLATS PENN ©,Bleu marine foncé,22.95,garçon,JUPE,69,viscose
TOP POLO À RAYURES PENN ©,Bleu marine foncé,22.95,garçon,TOP,73,viscose
T-SHIRT IMPRIMÉ CHUPA CHUPS ®,Écru,12.95,garçon,T-SHIRT,100,coton
POLO BRODÉ PENN ©,Vert,14.95,garçon,POLO,100,coton
BASKETS TECHNIQUES MULTIPIÈCES,Marron sable,39.95,garçon,BASKETS,35,polyuréthane
ENSEMBLE T-SHIRT ET BERMUDA À INSCRIPTION,Vin,17.95,garçon,ENSEMBLE,100,coton
SHORT EFFET ÉPONGE COLOR BLOCK BRODÉ,Jaune,16.95,garçon,SHORT,100,coton
T-SHIRT ONE PIECE NETFLIX ©,Bleu clair,12.95,garçon,T-SHIRT,100,coton
SALOPETTE COURTE À RAYURES PENN ©,Rayures,29.95,garçon,SALOPETTE,100,coton
BERMUDA RUSTIQUE À RAYURES,Écru,19.95,garçon,BERMUDA,100,coton
6-14 ANS/ SHORT DE BAIN SEERSUCKER À RAYURES,Bleu,16.95,garçon,6-14,100,polyester
SWEAT PENN ©,Gris chiné,25.95,garçon,SWEAT,62,coton
BLOUSON LÉGER DÉPERLANT PENN ©,Bleu,45.95,garçon,BLOUSON,100,polyamide
LUNETTES DE SOLEIL MÉTALLIQUES AVIATEUR,Argent,10.95,garçon,LUNETTES,90,cuivre
SHORT EFFET SERVIETTE PENN ©,Vert,17.95,garçon,SHORT,79,coton
JEAN DROIT,Blanc,19.95,garçon,JEAN,100,coton
TOP POLO TORSADÉ PENN ©,Rose fluo,22.95,garçon,TOP,87,coton
CASQUETTE À PIÈCE ET RÉSILLE,Bleu,8.95,garçon,CASQUETTE,100,coton
LOT DE CINQ CHAUSSETTES HAUTES À RAYURES,Multicolore,8.95,garçon,LOT,77,coton
PORTE-CLÉS PENDENTIF PENN ©,Vert,12.95,garçon,PORTE-CLÉS,43,fer
SHORT BAGGY ÉTIQUETTE,Écru,19.95,garçon,SHORT,72,coton
6-14 ANS/ SHORT DE BAIN BRODERIES MARINES,Bleu,16.95,garçon,6-14,100,polyester
SAC BOWLING PENN ©,Blanc,45.95,garçon,SAC,100,polyester
T-SHIRT ONE PIECE NETFLIX ©,Blanc,12.95,garçon,T-SHIRT,100,coton
COLLIER FANTAISIE ET COQUILLAGE,Marron,6.95,garçon,COLLIER,80,bois de manguier
PORTEFEUILLE TECHNIQUE,Multicolore,15.95,garçon,PORTEFEUILLE,100,polyester
SURCHEMISE À LOSANGES EN CROCHET,Bleu marine,29.95,garçon,SURCHEMISE,61,coton
ENSEMBLE T-SHIRT ET BERMUDA INTERLOCK,Bleu délavé,22.95,garçon,ENSEMBLE,50,coton
SWEAT MANCHES COURTES INSCRIPTION RELIEF,Bleu roi,9.95,garçon,SWEAT,60,coton
JEAN BAGGY STRUCTURÉ,Écru,22.95,garçon,JEAN,100,coton
T-SHIRT IMPRIMÉ HAMACS,Blanc,8.95,garçon,T-SHIRT,100,coton
T-SHIRT UNI SANS MANCHES,Blanc,5.95,garçon,T-SHIRT,100,coton
DÉGUISEMENT KPOP DEMON HUNTERS™ NETFLIX ©,Noir,39.95,garçon,DÉGUISEMENT,62,polyester
CASQUETTE LOGO BRODÉ,Vert foncé,8.95,garçon,CASQUETTE,100,coton
LOT DE TROIS CHAUSSETTES HAUTES À RAYURES SPORTIVES,Blanc,6.95,garçon,LOT,74,coton
6-14 ANS/ SHORT DE BAIN DOUBLE BAS CONTRASTÉ,Turquoise,16.95,garçon,6-14,100,polyamide
GANTS DÉGUISEMENT KPOP DEMON HUNTERS™ NETFLIX ©,Violet,9.95,garçon,GANTS,85,polyester
GRANDE BALLE DE TENNIS AVEC BOÎTE PENN ©,Jaune,15.95,garçon,GRANDE,80,acrylique
LUNETTES DE SOLEIL EN PLASTIQUE FINES,Bleu clair,10.95,garçon,LUNETTES,100,PCTG
T-SHIRT TEINT EN PIÈCE,Vert / Bleu,8.95,garçon,T-SHIRT,100,coton
BLOUSON LÉGER DÉPERLANT,Citron vert,29.95,garçon,BLOUSON,100,polyamide
GILET SPORT BIMATIÈRE,Noir,19.95,garçon,GILET,76,coton
CAPE DÉGUISEMENT KPOP DEMON HUNTERS™ NETFLIX ©,Noir,35.95,garçon,CAPE,100,polyester
TENNIS À LACETS,Blanc,22.95,garçon,TENNIS,100,polyuréthane
T-SHIRT YOSHI SUPER MARIO BROS ™ © NINTENDO,Vert bleu,12.95,garçon,T-SHIRT,100,coton
SANDALES TECHNIQUES,Jaune,19.95,garçon,SANDALES,90,polyester
JEAN BAGGY,Bleu,22.95,garçon,JEAN,100,coton
BERMUDA PENN ©,Écru,17.95,garçon,BERMUDA,100,coton
LOT DE DEUX SHORTS UNIS,Divers,17.95,garçon,LOT,75,coton
LOT DE TROIS SOCQUETTES À DAMIER,Multicolore,5.95,garçon,LOT,73,coton
BERMUDA EN MOLLETON ÉTIQUETTE,Bleu canard,12.95,garçon,BERMUDA,75,coton
BERMUDA EN JEAN FLUIDE,Bleu,17.95,garçon,BERMUDA,60,coton
TENNIS DE SPORT BAREFOOT,Blanc,29.95,garçon,TENNIS,41,polyuréthane
CHEMISE TEXTURÉE À RAYURES PENN ©,Bleu clair,25.95,garçon,CHEMISE,99,coton
BASKETS SPORT,Blanc marbre,35.95,garçon,BASKETS,62,polyester
BLOUSON KANGOUROU PENN ©,Vert,29.95,garçon,BLOUSON,100,polyamide
CASQUETTE BRODÉE PENN ©,Vert,12.95,garçon,CASQUETTE,100,coton
SAC BANANE TECHNIQUE,Multicolore,17.95,garçon,SAC,100,polyester
CHEMISE À RAYURES PENN ©,Vert / Écru,29.95,garçon,CHEMISE,100,coton
BERMUDA SPORT À INSCRIPTION,Vert / Bleu,16.95,garçon,BERMUDA,49,polyester
T-SHIRT LOURD À INSCRIPTION BRODÉE,Écru,8.95,garçon,T-SHIRT,100,coton
LOT DE DEUX CHAUSSETTES HAUTES NUMÉROTÉES,Multicolore,5.95,garçon,LOT,72,coton
6-14 ANS/ SHORT DE BAIN ÉTIQUETTE,Bleu,16.95,garçon,6-14,73,élastomultiester
BERMUDA À INSCRIPTION SPORT,Mandarine,16.95,garçon,BERMUDA,49,polyester
POLO EN MAILLE CROCHET,Bleu pastel,25.95,garçon,POLO,53,polyester
T-SHIRT IMPRIMÉ PENN ©,Blanc,12.95,garçon,T-SHIRT,100,coton
CHAPEAU BOB COUTURES,Écru / Chiné,9.95,garçon,CHAPEAU,100,coton
T-SHIRT RAYÉ ET INSCRIPTION,Bleu,16.95,garçon,T-SHIRT,70,coton
CLAQUETTES DE BAIN,Blanc écru,15.95,garçon,CLAQUETTES,100,acétate de vinyle d éthylène
CASQUETTE EFFET DÉLAVÉ BRODÉE,Bleu,7.95,garçon,CASQUETTE,100,coton
POLO BRODÉ PENN ©,Écru,14.95,garçon,POLO,100,coton
SHORT RUSTIQUE,Bleu / Vert,10.99,garçon,SHORT,72,polyester
SANDALES À BRIDES CROISÉES,Noir,29.95,garçon,SANDALES,100,polyuréthane
SHORT ÉLASTIQUES EN COTON,Citron vert,17.95,garçon,SHORT,100,coton
T-SHIRT SPORTIF TIE & DYE,Bleu / Blanc,9.95,garçon,T-SHIRT,100,coton
T-SHIRT IMPRIMÉ PENN ©,Vert,12.95,garçon,T-SHIRT,100,coton
CHEMISE BOWLING IMPRIMÉ À RAYURES,Écru,22.95,garçon,CHEMISE,100,coton
T-SHIRT UNI,Turquoise moyen,5.95,garçon,T-SHIRT,100,coton
BASKETS TECHNIQUES,Marron,35.95,garçon,BASKETS,76,polyester
LOT DE QUATRE SOCQUETTES UNIES,Blanc,5.95,garçon,LOT,74,coton
6-14 ANS/ SHORT DE BAIN STOPPER,Bleu,16.95,garçon,6-14,100,polyamide
BERMUDA CARGO,Bleu encre,15.95,garçon,BERMUDA,97,coton
GILET EN NYLON PENN ©,Bleu marine,29.95,garçon,GILET,100,polyamide
BERMUDA EN MOLLETON TEINT SUR PIÈCE AVEC LOGO,Lilas clair,15.95,garçon,BERMUDA,100,coton
GILET EN MAILLE PENN ©,Écru,29.95,garçon,GILET,100,coton
PANTALON À PLIS PENN ©,Pierre,45.95,garçon,PANTALON,100,coton
GILET EN MAILLE PENN ©,Vert / Écru,22.95,garçon,GILET,100,coton
SWEAT À INSCRIPTION PENN ©,Vert,25.95,garçon,SWEAT,100,coton
LOT DE TROIS HAUTS UNIS,Gris,14.95,garçon,LOT,100,coton
