nom,couleur,prix,collection,categorie,couleur,matiere_principale,type_matiere_principal
robe mi-longue fluide,mauve poudré,25.99,femme,robe,rose/violet,viscose,fibre artificielle
sandales à brides et décor métallique,marron,39.95,femme,sandales,marron,polyuréthane,fibre synthétique
combi-short lyocell,noir,35.95,femme,combi-short,noir/gris,lyocell,fibre artificielle
jean trf loose folded taille basse à rayures,unique,35.95,femme,jean,autres,coton,fibre naturelle végétale
robe fluide à encolure américaine,vert huile,35.95,femme,robe,vert,viscose,fibre artificielle
veste croisée,brique foncée,32.95,femme,veste,autres,viscose,fibre artificielle
lot de 3 bracelets bois et résine,multicolore,19.95,femme,lot,motif/multicolore,bois de manguier,autres
sandales à talons imprimées,léopard,32.95,femme,sandales,motif/multicolore,polyester,fibre synthétique
short fluide avec boutons,mauve clair,22.95,femme,short,rose/violet,viscose,fibre artificielle
t-shirt texte brillant effet délavé,gris anthracite,19.95,femme,t-shirt,noir/gris,coton,fibre naturelle végétale
veste à rayures 100% lin,brown stripes,45.95,femme,veste,autres,lin,fibre naturelle végétale
pantalon droit à rayures,beige-marron,39.95,femme,pantalon,blanc/beige,coton,fibre naturelle végétale
chemise cintree froncee,écru / noir,25.95,femme,chemise,noir/gris,coton,fibre naturelle végétale
chemise fluide à manches courtes,mauve clair,25.95,femme,chemise,rose/violet,viscose,fibre artificielle
blouson ajusté à brandebourgs,blanc,59.95,femme,blouson,blanc/beige,coton,fibre naturelle végétale
top à boutons et lin,bleu-poudré,15.95,femme,top,bleu,coton,fibre naturelle végétale
top en georgette à encolure américaine et à pois,blanc / noir,22.95,femme,top,noir/gris,polyester,fibre synthétique
top fluide col en v,écru,22.95,femme,top,blanc/beige,polyester,fibre synthétique
chemise oversize en coton,bleu marine,22.95,femme,chemise,bleu,coton,fibre naturelle végétale
robe courte halter fluide,noir,29.95,femme,robe,noir/gris,lyocell,fibre artificielle
jupe asymétrique fluide,sable,29.95,femme,jupe,autres,polyester,fibre synthétique
short mini denim trf étoiles,bleu,29.95,femme,short,bleu,coton,fibre naturelle végétale
chemise fluide à manches courtes,bleu clair,29.95,femme,chemise,bleu,lyocell,fibre artificielle
pantalon à rayures 100 % lin,brown stripes,39.95,femme,pantalon,autres,lin,fibre naturelle végétale
bonnet lisse calotte,beige clair,25.95,femme,bonnet,blanc/beige,pâte de cellulose,fibre artificielle
short évasé en satin,imprimée,25.95,femme,short,motif/multicolore,polyester,fibre synthétique
pantalon fluide large,brique foncée,32.95,femme,pantalon,autres,viscose,fibre artificielle
pantalon fluide à cordons,bleu clair,29.95,femme,pantalon,bleu,lyocell,fibre artificielle
sandales plates en daim à boucle,marron,35.95,femme,sandales,marron,cuir de vache,cuir
bonnet calot tressé,marron,17.95,femme,bonnet,marron,polyester,fibre synthétique
robe courte en maille à rayures,blanc / noir,29.95,femme,robe,noir/gris,polyester,fibre synthétique
lunettes de soleil rectangulaires,rouge foncé,59.95,homme,lunettes,rouge,acétate,fibre artificielle
blazer regular fit en daim,sable,199.0,homme,blazer,autres,cuir de chèvre,cuir
sac shopper en tissu,blanc écru,29.95,homme,sac,blanc/beige,coton,fibre naturelle végétale
t-shirt imprimé contrastant avec pièce,bleu ciel,22.95,homme,t-shirt,bleu,coton,fibre naturelle végétale
pantalon à plis de costume 100 % lin,blanc,59.95,homme,pantalon,blanc/beige,lin,fibre naturelle végétale
lunettes de soleil œil-de-chat,noir,59.95,homme,lunettes,noir/gris,diacétate de cellulose,fibre artificielle
lunettes de soleil rectangulaires,écaille,59.95,homme,lunettes,autres,acétate,fibre artificielle
blouson technique relaxed fit,écru,59.95,homme,blouson,blanc/beige,polyamide,fibre synthétique
chemise à carreaux brodée contrastée,camel/blanc,35.95,homme,chemise,blanc/beige,coton,fibre naturelle végétale
jort en denim à ceinture,marron,49.95,homme,jort,marron,coton,fibre naturelle végétale
mocassins en cuir avec masque,noir,59.95,homme,mocassins,noir/gris,cuir de vache,cuir
sac bandoulière en cuir,noir,49.95,homme,sac,noir/gris,cuir de vache,cuir
polo technique à zip,écru moyen,35.95,homme,polo,blanc/beige,polyester,fibre synthétique
sac bandoulière unie,marron,35.95,homme,sac,marron,polyester,fibre synthétique
espadrille en cuir,marron sable,55.95,homme,espadrille,marron,cuir de vache,cuir
sweat piqué col zippé,bleu marine,35.95,homme,sweat,bleu,coton,fibre naturelle végétale
bandana à imprimé géométrique graphique,bleu marine,15.95,homme,bandana,bleu,coton,fibre naturelle végétale
chemise fluide à imprimé fleuri,bleu moyen,45.95,homme,chemise,bleu,viscose,fibre artificielle
chemise smoking à poignets mousquetaires,blanc,39.95,homme,chemise,blanc/beige,coton,fibre naturelle végétale
pantalon relaxed straight fit à rayures,rayures,49.95,homme,pantalon,autres,coton,fibre naturelle végétale
veste en denim avec brandenbourgs et boutons,charbon,89.95,homme,veste,autres,coton,fibre naturelle végétale
blouson délavé coupe décontractée,bleu encre,49.95,homme,blouson,bleu,coton,fibre naturelle végétale
chemise à carreaux lin et coton,grisâtre,39.95,homme,chemise,noir/gris,coton,fibre naturelle végétale
veste de costume à boutonnage croisé 100% lin chevron,indigo,139.0,homme,veste,autres,lin,fibre naturelle végétale
bermuda fluide douce à plis,bleu marine,35.95,homme,bermuda,bleu,modal,fibre artificielle
lunettes de soleil ovales,vert olive,59.95,homme,lunettes,vert,diacétate de cellulose,fibre artificielle
chemise en maille regular fit,vert clair,39.95,homme,chemise,vert,papier,autres
veste de costume relaxed fit 100% lin,blanc,119.0,homme,veste,blanc/beige,lin,fibre naturelle végétale
pantalon regular fit de smoking à bandes,noir,59.95,homme,pantalon,noir/gris,polyester,fibre synthétique
lunettes de soleil rectangulaires,990,59.95,homme,lunettes,autres,acétate,fibre artificielle
ceinture en cuir effet vintage,noir,35.95,homme,ceinture,noir/gris,cuir de vachette,cuir
pantalon chino straight fit délavé,bleu,49.95,homme,pantalon,bleu,coton,fibre naturelle végétale
polo structuré en piqué,blanc cassé,29.95,homme,polo,blanc/beige,coton,fibre naturelle végétale
pantalon coupe décontractée à plis,blanc cassé,59.95,homme,pantalon,blanc/beige,coton,fibre naturelle végétale
t-shirt en jacquard à rayures,bleu,29.95,homme,t-shirt,bleu,coton,fibre naturelle végétale
chemise relaxed fit 100% lin poches plis,marron / taupe,39.95,homme,chemise,marron,lin,fibre naturelle végétale
chemise col smoking,blanc,39.95,homme,chemise,blanc/beige,coton,fibre naturelle végétale
veste à rayures 100 % lin,indigo,99.95,homme,veste,autres,lin,fibre naturelle végétale
chemise regular fit 100% lin,sable / chiné,39.95,homme,chemise,autres,lin,fibre naturelle végétale
chemise à rayures et imprimé citrons,jaune,35.95,homme,chemise,jaune/orange,coton,fibre naturelle végétale
pantalon coupe décontractée en viscose et chanvre,blanc cassé,49.95,homme,pantalon,blanc/beige,viscose,fibre artificielle
lunettes de soleil ovales,marron,59.95,homme,lunettes,marron,acier inoxydable,autres
polo piqué regular fit,bleu roi,29.95,homme,polo,bleu,coton,fibre naturelle végétale
pantalon relaxed fit viscose lin ceinture,noir,49.95,homme,pantalon,noir/gris,viscose,fibre artificielle
chemise relaxed fit à imprimé géométrique,tuile,35.95,homme,chemise,autres,coton,fibre naturelle végétale
chemise relaxed fit viscose - chanvre,blanc cassé,39.95,homme,chemise,blanc/beige,viscose,fibre artificielle
surchemise à pièces étoiles,bleu encre,69.95,homme,surchemise,bleu,coton,fibre naturelle végétale
chemise regular fit 100% lin,marron chiné,39.95,homme,chemise,marron,lin,fibre naturelle végétale
pantalon regular fit viscose - coton,blanc cassé,59.95,homme,pantalon,blanc/beige,viscose,fibre artificielle
chaussettes cannelées,jaune,7.95,homme,chaussettes,jaune/orange,coton,fibre naturelle végétale
débardeur en maille imprimé lavé,noir,22.95,homme,débardeur,noir/gris,coton,fibre naturelle végétale
t-shirt regular fit jacquard à rayures,blanc-orange,22.95,homme,t-shirt,blanc/beige,coton,fibre naturelle végétale
blazer smoking à revers châle,noir,119.0,homme,blazer,noir/gris,polyester,fibre synthétique
pantalon relaxed fit viscose - lin ceinture,écru,49.95,homme,pantalon,blanc/beige,viscose,fibre artificielle
lunettes de soleil métalliques carrées,argent,59.95,homme,lunettes,noir/gris,acier inoxydable,autres
chemise à carreaux lin et coton,grisâtre,39.95,homme,chemise,noir/gris,coton,fibre naturelle végétale
bermuda regular fit à plis,blanc cassé,35.95,homme,bermuda,blanc/beige,coton,fibre naturelle végétale
ceinture en soie pour smoking,noir,35.95,homme,ceinture,noir/gris,soie (de mûrier),fibre naturelle animale
pantalon regular fit à plis smoking,noir,59.95,homme,pantalon,noir/gris,laine,fibre naturelle animale
chemise relaxed fit texte pièces,écru,35.95,homme,chemise,blanc/beige,coton,fibre naturelle végétale
lunettes de soleil métalliques ovales,argent mat,59.95,homme,lunettes,noir/gris,acier inoxydable,autres
chemise relaxed fit à imprimé patchwork,multicolore,45.95,homme,chemise,motif/multicolore,viscose,fibre artificielle
bermuda en jean relaxed fit plisse,bleu,49.95,homme,bermuda,bleu,coton,fibre naturelle végétale
blouson délavé coupe décontractée,bleu encre,49.95,homme,blouson,bleu,coton,fibre naturelle végétale
sandales style pêcheur en cuir,beige,59.95,homme,sandales,blanc/beige,cuir de vache,cuir
t-shirt relaxed fit à imprimé graphique,bordeaux,22.95,homme,t-shirt,rouge,coton,fibre naturelle végétale
bandana à imprimé paisley,bleu,15.95,homme,bandana,bleu,coton,fibre naturelle végétale
chemise fluide soft,bleu marine,39.95,homme,chemise,bleu,modal,fibre artificielle
chemise regular fit 100% lin,blanc,39.95,homme,chemise,blanc/beige,lin,fibre naturelle végétale
sac bandoulière en cuir,vert kaki,35.95,homme,sac,vert,cuir de porc,cuir
surchemise relaxed fit zippée,bleu,35.95,homme,surchemise,bleu,coton,fibre naturelle végétale
bermuda baggy fit à boutons,brun,35.95,homme,bermuda,autres,coton,fibre naturelle végétale
jean droit contraste,gris / beige,49.95,homme,jean,noir/gris,coton,fibre naturelle végétale
collier fantaisie pierre,bleu/noir,22.95,homme,collier,noir/gris,pierre,autres
pantalon de costume chevron 100% lin,indigo,69.95,homme,pantalon,autres,lin,fibre naturelle végétale
sac shopper tressé,marron,35.95,homme,sac,marron,papier,autres
veste en jean à fermeture éclair,bleu,59.95,homme,veste,bleu,coton,fibre naturelle végétale
ceinture en cuir tressé,noir,35.95,homme,ceinture,noir/gris,cuir de vachette,cuir
pantalon cargo parachute délavé,gris clair,49.95,homme,pantalon,noir/gris,coton,fibre naturelle végétale
sabots en cuir,vert d'eau,49.95,homme,sabots,vert,cuir de vache,cuir
baskets style rétro,multicolore,39.95,homme,baskets,motif/multicolore,polyester,fibre synthétique
lunettes de soleil œil-de-chat,noir,59.95,homme,lunettes,noir/gris,diacétate de cellulose,fibre artificielle
t-shirt relaxed fit à imprimé graphique,blanc,22.95,homme,t-shirt,blanc/beige,coton,fibre naturelle végétale
frisbee graphique imprimé,rouge,22.95,homme,frisbee,rouge,polyéthylène,fibre synthétique
chapeau bob bord large,kaki,22.95,homme,chapeau,vert,coton,fibre naturelle végétale
ceinture en cuir surpiquée,noir,35.95,homme,ceinture,noir/gris,cuir de vachette,cuir
veste regular fit à poches,blanc cassé,59.95,homme,veste,blanc/beige,coton,fibre naturelle végétale
mocassins en cuir à masque,marron,99.95,homme,mocassins,marron,cuir de vache,cuir
pull regular fit 100% lin,bleu / acier,69.95,homme,pull,bleu,lin,fibre naturelle végétale
chemise fluide à nœud,blanc,39.95,homme,chemise,blanc/beige,viscose,fibre artificielle
t-shirt en maille délavé imprimés,noir,25.95,homme,t-shirt,noir/gris,coton,fibre naturelle végétale
chemise structurée oxford,bleu / blanc,29.95,homme,chemise,blanc/beige,coton,fibre naturelle végétale
maillot de bain deux pièces brillant 6-14 ans,bleu clair,19.95,fille,maillot,bleu,polyamide,fibre synthétique
ensemble t-shirt et bermuda à rayures,bleu,17.95,fille,ensemble,bleu,polyester,fibre synthétique
ballerines sport barefoot,blanc écru,35.95,fille,ballerines,blanc/beige,polyester,fibre synthétique
pantalon en molleton wide leg penn ©,vert / écru,22.95,fille,pantalon,blanc/beige,coton,fibre naturelle végétale
short à rayures penn ©,bleu clair,19.95,fille,short,bleu,coton,fibre naturelle végétale
top halter fantaisie,jaune,7.95,fille,top,jaune/orange,coton,fibre naturelle végétale
lot de deux colliers fantaisie et coquillages,turquoise,7.95,fille,lot,bleu,verre,autres
jupe à plis plats penn ©,bleu marine foncé,22.95,fille,jupe,bleu,viscose,fibre artificielle
top polo à rayures penn ©,bleu marine foncé,22.95,fille,top,bleu,viscose,fibre artificielle
baskets de sport combinées,bleu,29.95,fille,baskets,bleu,polyester,fibre synthétique
polo brodé penn ©,vert,14.95,fille,polo,vert,coton,fibre naturelle végétale
maillot de bain fleur hibiscus 2-6 ans,fuchsia,15.95,fille,maillot,rose/violet,polyester,fibre synthétique
sandales de bain cœur,rose,15.95,fille,sandales,rose/violet,caoutchouc,autres
salopette courte à rayures penn ©,rayures,29.95,fille,salopette,autres,coton,fibre naturelle végétale
sweat penn ©,gris chiné,25.95,fille,sweat,noir/gris,coton,fibre naturelle végétale
blouson léger déperlant penn ©,bleu,45.95,fille,blouson,bleu,polyamide,fibre synthétique
short effet serviette penn ©,vert,17.95,fille,short,vert,coton,fibre naturelle végétale
tennis en cuir,blanc,39.95,fille,tennis,blanc/beige,cuir de vache,cuir
maillot de bain à rayures 6-14 ans,rayures,17.95,fille,maillot,autres,polyester,fibre synthétique
pantalon large schiffly,vert,25.95,fille,pantalon,vert,coton,fibre naturelle végétale
top polo torsadé penn ©,rose fluo,22.95,fille,top,rose/violet,coton,fibre naturelle végétale
paréo hibiscus et fantaisies,fuchsia,15.95,fille,paréo,rose/violet,coton,fibre naturelle végétale
porte-clés pendentif penn ©,vert,12.95,fille,porte-clés,vert,fer,autres
lot de cinq chaussettes hautes à rayures,multicolore,8.95,fille,lot,motif/multicolore,coton,fibre naturelle végétale
t-shirt epais rayures,rose / blanc,10.95,fille,t-shirt,blanc/beige,coton,fibre naturelle végétale
sac bowling penn ©,blanc,45.95,fille,sac,blanc/beige,polyester,fibre synthétique
tennis ou basket à semelle épaisse,blanc,25.95,fille,tennis,blanc/beige,polyuréthane,fibre synthétique
ensemble t-shirt à lacets et pantalon jogger,bleu moyen,19.95,fille,ensemble,bleu,coton,fibre naturelle végétale
basket ouverte,argent,35.95,fille,basket,noir/gris,polyuréthane,fibre synthétique
sandales en cuir,noir,39.95,fille,sandales,noir/gris,cuir de mouton,cuir
lot de trois chaussettes hautes à rayures sportives,blanc,6.95,fille,lot,blanc/beige,coton,fibre naturelle végétale
t-shirt stickers hello kitty © sanrio,blanc,10.95,fille,t-shirt,blanc/beige,coton,fibre naturelle végétale
grande balle de tennis avec boîte penn ©,jaune,15.95,fille,grande,jaune/orange,acrylique,fibre synthétique
lunettes de soleil en plastique fines,bleu clair,10.95,fille,lunettes,bleu,pctg,autres
gilet matelassé,bleu marine,29.95,fille,gilet,bleu,polyamide,fibre synthétique
lot de trois pinces à rayures,bleu,6.95,fille,lot,bleu,plastique-acrylique,autres
short 100 % lin,vert olive,22.95,fille,short,vert,lin,fibre naturelle végétale
pantalon imprimé fleurs avec lin,écru,22.95,fille,pantalon,blanc/beige,viscose,fibre artificielle
tennis à lacets,blanc,22.95,fille,tennis,blanc/beige,polyuréthane,fibre synthétique
t-shirt jogging en molleton,sable / chiné,12.95,fille,t-shirt,autres,coton,fibre naturelle végétale
lot de deux colliers papillons,doré,6.95,fille,lot,jaune/orange,fer,autres
bermuda penn ©,écru,17.95,fille,bermuda,blanc/beige,coton,fibre naturelle végétale
jupe-short à volants et rayures,blanc,17.95,fille,jupe-short,blanc/beige,polyester,fibre synthétique
chemise texturée à rayures penn ©,bleu clair,25.95,fille,chemise,bleu,coton,fibre naturelle végétale
sac bandoulière fantaisie,multicolore,25.95,fille,sac,motif/multicolore,coton,fibre naturelle végétale
blouson kangourou penn ©,vert,29.95,fille,blouson,vert,polyamide,fibre synthétique
casquette brodée penn ©,vert,12.95,fille,casquette,vert,coton,fibre naturelle végétale
bonnet bob penn ©,beige,12.95,fille,bonnet,blanc/beige,coton,fibre naturelle végétale
lot de quatre chouchous à rayures,multicolore,4.95,fille,lot,motif/multicolore,polyamide,fibre synthétique
bonnet bob texte brodé,turquoise,10.95,fille,bonnet,bleu,coton,fibre naturelle végétale
robe drapée en lin,rose fluo,27.95,fille,robe,rose/violet,viscose,fibre artificielle
short en jean déchiré,rouge,17.95,fille,short,rouge,coton,fibre naturelle végétale
chemise à rayures penn ©,vert / écru,29.95,fille,chemise,blanc/beige,coton,fibre naturelle végétale
ballerines sport,bleu,29.95,fille,ballerines,bleu,polyester,fibre synthétique
6-14 ans/ maillot de bain texture fleurs 3d,bleu moyen,17.95,fille,6-14,bleu,polyamide,fibre synthétique
haut détail en maille crochet,blanc,9.95,fille,haut,blanc/beige,coton,fibre naturelle végétale
legging court côtelé,jaune,4.95,fille,legging,jaune/orange,coton,fibre naturelle végétale
basket compensée,blanc,22.95,fille,basket,blanc/beige,polyuréthane,fibre synthétique
top boule en lin,écru,22.95,fille,top,blanc/beige,viscose,fibre artificielle
lot trois hauts à rayures,divers,14.95,fille,lot,autres,coton,fibre naturelle végétale
lot de trois pinces fleurs hibiscus,vert,6.95,fille,lot,vert,plastique,autres
pantalon en molleton heavy jersey à jambes larges,jaune,12.95,fille,pantalon,jaune/orange,coton,fibre naturelle végétale
poncho serviette à pois,rose,19.95,fille,poncho,rose/violet,coton,fibre naturelle végétale
bermuda en jean à rayures,bordeaux,19.95,fille,bermuda,rouge,coton,fibre naturelle végétale
t-shirt teint en pièce imprimé,gris anthracite,9.95,fille,t-shirt,noir/gris,coton,fibre naturelle végétale
t-shirt imprimé penn ©,blanc,12.95,fille,t-shirt,blanc/beige,coton,fibre naturelle végétale
chapeau bob coutures,écru / chiné,9.95,fille,chapeau,blanc/beige,coton,fibre naturelle végétale
casquette effet délavé brodée,bleu,7.95,fille,casquette,bleu,coton,fibre naturelle végétale
polo brodé penn ©,écru,14.95,fille,polo,blanc/beige,coton,fibre naturelle végétale
ciré effet gomme à capuche déperlant,bis,35.95,fille,ciré,autres,polyester,fibre synthétique
6-14 ans/bikini texture nœud,fuchsia,17.95,fille,6-14,rose/violet,polyester,fibre synthétique
sac bandoulière technique,multicolore,19.95,fille,sac,motif/multicolore,polyamide,fibre synthétique
bermuda waffle à inscription,jaune,8.95,fille,bermuda,jaune/orange,coton,fibre naturelle végétale
t-shirt rayé à manches raglan,jaune,9.95,fille,t-shirt,jaune/orange,coton,fibre naturelle végétale
veste en jean,bleu,25.95,fille,veste,bleu,coton,fibre naturelle végétale
sandales techniques,noir,29.95,fille,sandales,noir/gris,polyester,fibre synthétique
t-shirt imprimé penn ©,vert,12.95,fille,t-shirt,vert,coton,fibre naturelle végétale
haut côtelé nageur,bleu roi,5.95,fille,haut,bleu,coton,fibre naturelle végétale
bermuda 100% lin,rose,22.95,fille,bermuda,rose/violet,lin,fibre naturelle végétale
sac à dos technique,multicolore,35.95,fille,sac,motif/multicolore,polyamide,fibre synthétique
gilet en nylon penn ©,bleu marine,29.95,fille,gilet,bleu,polyamide,fibre synthétique
gilet en maille penn ©,écru,29.95,fille,gilet,blanc/beige,coton,fibre naturelle végétale
pantalon à plis penn ©,pierre,45.95,fille,pantalon,autres,coton,fibre naturelle végétale
sweat zippé basique,écru,17.95,fille,sweat,blanc/beige,coton,fibre naturelle végétale
sweat à inscription penn ©,vert,25.95,fille,sweat,vert,coton,fibre naturelle végétale
gilet en maille penn ©,vert / écru,22.95,fille,gilet,blanc/beige,coton,fibre naturelle végétale
tennis ou basket avec détail cœur,blanc,25.95,fille,tennis,blanc/beige,polyuréthane,fibre synthétique
lot de cinq socquettes,multicolore,7.95,fille,lot,motif/multicolore,coton,fibre naturelle végétale
lunettes de soleil carrées en plastique,bleu,10.95,fille,lunettes,bleu,pctg,autres
casquette en résille broderie florale,jaune,8.95,fille,casquette,jaune/orange,coton,fibre naturelle végétale
tennis penn ©,blanc,39.95,fille,tennis,blanc/beige,polyuréthane,fibre synthétique
tennis à rabat et pièces,blanc,29.95,fille,tennis,blanc/beige,polyuréthane,fibre synthétique
t-shirt à inscription imprimée,jaune,8.95,fille,t-shirt,jaune/orange,coton,fibre naturelle végétale
bermuda de jogging en molleton,sable / chiné,8.95,fille,bermuda,autres,coton,fibre naturelle végétale
lot bandeau et bracelet penn ©,bleu roi,8.95,fille,lot,bleu,coton,fibre naturelle végétale
ensemble côtelé délavé t-shirt nageur et bermuda,pourpre,17.95,fille,ensemble,autres,coton,fibre naturelle végétale
short à inscription et contraste,blanc,8.95,fille,short,blanc/beige,coton,fibre naturelle végétale
short en popeline à pinces penn ©,beige clair,22.95,fille,short,blanc/beige,coton,fibre naturelle végétale
bermuda en jean longue penn ©,bleu clair,22.95,fille,bermuda,bleu,coton,fibre naturelle végétale
casquette résille minecraft © mojang ab. ™,vert,9.95,garçon,casquette,vert,coton,fibre naturelle végétale
6-14 ans / short de bain uni,citron vert,16.95,garçon,6-14,vert,polyamide,fibre synthétique
t-shirt sport à inscription,mandarine,12.95,garçon,t-shirt,autres,polyester,fibre synthétique
pantalon en molleton wide leg penn ©,vert / écru,22.95,garçon,pantalon,blanc/beige,coton,fibre naturelle végétale
short à rayures penn ©,bleu clair,19.95,garçon,short,bleu,coton,fibre naturelle végétale
sweat imprimé,écru,19.95,garçon,sweat,blanc/beige,coton,fibre naturelle végétale
ensemble t-shirt et bermuda uni teint sur pièce,grenat clair,22.95,garçon,ensemble,autres,coton,fibre naturelle végétale
jean relaxed ballon,bleu clair,22.95,garçon,jean,bleu,coton,fibre naturelle végétale
jupe à plis plats penn ©,bleu marine foncé,22.95,garçon,jupe,bleu,viscose,fibre artificielle
top polo à rayures penn ©,bleu marine foncé,22.95,garçon,top,bleu,viscose,fibre artificielle
t-shirt imprimé chupa chups ®,écru,12.95,garçon,t-shirt,blanc/beige,coton,fibre naturelle végétale
polo brodé penn ©,vert,14.95,garçon,polo,vert,coton,fibre naturelle végétale
baskets techniques multipièces,marron sable,39.95,garçon,baskets,marron,polyuréthane,fibre synthétique
ensemble t-shirt et bermuda à inscription,vin,17.95,garçon,ensemble,autres,coton,fibre naturelle végétale
short effet éponge color block brodé,jaune,16.95,garçon,short,jaune/orange,coton,fibre naturelle végétale
t-shirt one piece netflix ©,bleu clair,12.95,garçon,t-shirt,bleu,coton,fibre naturelle végétale
salopette courte à rayures penn ©,rayures,29.95,garçon,salopette,autres,coton,fibre naturelle végétale
bermuda rustique à rayures,écru,19.95,garçon,bermuda,blanc/beige,coton,fibre naturelle végétale
6-14 ans/ short de bain seersucker à rayures,bleu,16.95,garçon,6-14,bleu,polyester,fibre synthétique
sweat penn ©,gris chiné,25.95,garçon,sweat,noir/gris,coton,fibre naturelle végétale
blouson léger déperlant penn ©,bleu,45.95,garçon,blouson,bleu,polyamide,fibre synthétique
lunettes de soleil métalliques aviateur,argent,10.95,garçon,lunettes,noir/gris,cuivre,autres
short effet serviette penn ©,vert,17.95,garçon,short,vert,coton,fibre naturelle végétale
jean droit,blanc,19.95,garçon,jean,blanc/beige,coton,fibre naturelle végétale
top polo torsadé penn ©,rose fluo,22.95,garçon,top,rose/violet,coton,fibre naturelle végétale
casquette à pièce et résille,bleu,8.95,garçon,casquette,bleu,coton,fibre naturelle végétale
lot de cinq chaussettes hautes à rayures,multicolore,8.95,garçon,lot,motif/multicolore,coton,fibre naturelle végétale
porte-clés pendentif penn ©,vert,12.95,garçon,porte-clés,vert,fer,autres
short baggy étiquette,écru,19.95,garçon,short,blanc/beige,coton,fibre naturelle végétale
6-14 ans/ short de bain broderies marines,bleu,16.95,garçon,6-14,bleu,polyester,fibre synthétique
sac bowling penn ©,blanc,45.95,garçon,sac,blanc/beige,polyester,fibre synthétique
t-shirt one piece netflix ©,blanc,12.95,garçon,t-shirt,blanc/beige,coton,fibre naturelle végétale
collier fantaisie et coquillage,marron,6.95,garçon,collier,marron,bois de manguier,autres
portefeuille technique,multicolore,15.95,garçon,portefeuille,motif/multicolore,polyester,fibre synthétique
surchemise à losanges en crochet,bleu marine,29.95,garçon,surchemise,bleu,coton,fibre naturelle végétale
ensemble t-shirt et bermuda interlock,bleu délavé,22.95,garçon,ensemble,bleu,coton,fibre naturelle végétale
sweat manches courtes inscription relief,bleu roi,9.95,garçon,sweat,bleu,coton,fibre naturelle végétale
jean baggy structuré,écru,22.95,garçon,jean,blanc/beige,coton,fibre naturelle végétale
t-shirt imprimé hamacs,blanc,8.95,garçon,t-shirt,blanc/beige,coton,fibre naturelle végétale
t-shirt uni sans manches,blanc,5.95,garçon,t-shirt,blanc/beige,coton,fibre naturelle végétale
déguisement kpop demon hunters™ netflix ©,noir,39.95,garçon,déguisement,noir/gris,polyester,fibre synthétique
casquette logo brodé,vert foncé,8.95,garçon,casquette,vert,coton,fibre naturelle végétale
lot de trois chaussettes hautes à rayures sportives,blanc,6.95,garçon,lot,blanc/beige,coton,fibre naturelle végétale
